{"$schema":"https://json-schema.org/draft/2020-12/schema","type":"object","required":["schema_version","profile_id","title","project_kind","required_rule_ids","recommended_rule_ids","forbidden_rule_ids","language_documents","framework_documents","database_documents","review_checklists","template_contract"],"properties":{"schema_version":{"const":1},"profile_id":{"type":"string","pattern":"^[a-z0-9]+(?:-[a-z0-9]+)*$"},"title":{"type":"string","minLength":1},"project_kind":{"type":"string","minLength":1},"required_rule_ids":{"type":"array","items":{"type":"string"}},"recommended_rule_ids":{"type":"array","items":{"type":"string"}},"forbidden_rule_ids":{"type":"array","items":{"type":"string"}},"language_documents":{"type":"array","items":{"type":"string"}},"framework_documents":{"type":"array","items":{"type":"string"}},"database_documents":{"type":"array","items":{"type":"string"}},"review_checklists":{"type":"array","items":{"type":"string"}},"template_contract":{"type":"object","required":["required_paths","forbidden_paths","required_capabilities","forbidden_capabilities"],"properties":{"required_paths":{"type":"array","items":{"type":"string"}},"forbidden_paths":{"type":"array","items":{"type":"string"}},"required_capabilities":{"type":"array","items":{"type":"string"}},"forbidden_capabilities":{"type":"array","items":{"type":"string"}}},"additionalProperties":false}},"additionalProperties":false}
