{"schema_version":1,"profile_id":"go-service","title":"Go service","project_kind":"service","required_rule_ids":["STACK-BACKEND-002","DB-LIQUIBASE-001","GO-CONTEXT-001"],"recommended_rule_ids":["GO-ERROR-001","CONTRACT-001","SEC-SECRETS-001","TEST-001"],"forbidden_rule_ids":["STACK-NODE-001"],"language_documents":["docs/engineering/languages/GO.md"],"framework_documents":["docs/engineering/frameworks/GO_GIN.md","docs/engineering/frameworks/GO_PGX_SQLC.md"],"database_documents":["docs/engineering/database/POSTGRESQL.md","docs/engineering/database/LIQUIBASE.md"],"review_checklists":["docs/engineering/review-checklists/GO.md"],"template_contract":{"required_paths":["cmd","internal","engineering-profile.json"],"forbidden_paths":["prisma"],"required_capabilities":["graceful-shutdown"],"forbidden_capabilities":["startup-ddl"]}}
