{"schema_version":1,"profile_id":"python-prototype","title":"Python prototype","project_kind":"prototype","required_rule_ids":["SEC-SECRETS-001","TEST-001"],"recommended_rule_ids":["PY-TYPING-001","PY-SUBPROCESS-001","DEP-001"],"forbidden_rule_ids":["STACK-NODE-001"],"language_documents":["docs/engineering/languages/PYTHON.md"],"framework_documents":[],"database_documents":[],"review_checklists":["docs/engineering/review-checklists/PYTHON.md"],"template_contract":{"required_paths":["README.md","engineering-profile.json"],"forbidden_paths":["node-backend"],"required_capabilities":["safe-config"],"forbidden_capabilities":["startup-ddl"]}}
